{
  "$schema": "./build.schema.json",
  "Solution": "Groupify.sln",
  "ArtifactsType": "*.nupkg",
  "ExcludedArtifactsType": "symbols.nupkg",
  "MyGetNugetFeed": "https://www.myget.org/F/groupify/api/v3/index.json",
  "NugetFeed": "https://api.nuget.org/v3/index.json",
  "NugetDescription": "",
  "Copyright": "Â©Kim Ipsen 2024"
}
